ID,parent_ID,restrictionRef,bridgeRef,bridge_ID,name,descr,restrictionCategory,restrictionType,restrictionValue,restrictionUnit,restrictionStatus,appliesToVehicleClass,grossMassLimit,axleMassLimit,heightLimit,widthLimit,lengthLimit,speedLimit,permitRequired,escortRequired,temporary,active,effectiveFrom,effectiveTo,approvedBy,direction,enforcementAuthority,temporaryFrom,temporaryTo,temporaryReason,approvalReference,issuingAuthority,legalReference,remarks
16aaaaaa-aaaa-aaaa-aaaa-aaaaaaaaaaaa,,RST-0001,BRG-QLD001-003,251,Story Bridge Mass Limit,Posted mass limit for heritage cantilever bridge,Permanent,Mass Limit,30,tonne,Active,Heavy Vehicles,30,12.5,,,,60,false,false,false,true,2020-01-01,,Transport and Main Roads QLD,Both,Queensland Police Service,,,,,TMR-QLD-2020-001,Department of Transport and Main Roads QLD,QLD Gazette 2024/123,Heritage asset — structural assessment 2019 confirmed 30t limit
15aaaaaa-aaaa-aaaa-aaaa-aaaaaaaaaaaa,,RST-0002,BRG-VIC001-004,252,Bolte Bridge Dimension Limit,Oversize vehicle clearance restriction,Permanent,Dimension Limit,4.8,metre,Active,Oversize Overmass,,,4.8,3.5,30,,true,true,false,true,2015-06-01,,Department of Transport and Planning VIC,Both,Victoria Police,,,,,VicRoads-2015-088,Department of Transport and Planning Victoria,VIC Gazette 2025/14,Clearance verified by laser survey June 2015
11aaaaaa-aaaa-aaaa-aaaa-aaaaaaaaaaaa,,RST-0003,BRG-NSW001-001,201,Sydney Harbour Bridge Permit Route,NHVR Permit-required route for OSOM vehicles,Permanent,Access Restriction,,,,,Active,Oversize Overmass,,,,,,true,true,false,true,2018-01-01,,Transport for NSW,Both,NSW Police,,,,,TfNSW-2018-NHVR-001,Transport for NSW,NSW Gazette 2025/100,All PBS and OSOM vehicles require NHVR permit prior to crossing
17aaaaaa-aaaa-aaaa-aaaa-aaaaaaaaaaaa,,RST-0004,BRG-TAS001-005,301,Tasman Bridge Speed Restriction,Speed restriction due to wind loading on steel girders,Permanent,Speed Restriction,60,km/h,Active,All Vehicles,,,,,,60,false,false,false,true,2010-03-15,,Department of State Growth TAS,Both,Tasmania Police,,,,,DSG-TAS-2010-022,Department of State Growth Tasmania,,Wind loading per AS 1170.2 — sustained cross-wind events trigger further reduction
18aaaaaa-aaaa-aaaa-aaaa-aaaaaaaaaaaa,,RST-0005,BRG-NSW001-002,207,Anzac Bridge Temporary Emergency Closure,Emergency closure following 2024 cable stay inspection,Temporary,Access Restriction,,,,,Retired,All Vehicles,,,,,,false,false,true,false,2024-08-01,2024-08-14,Transport for NSW,Both,NSW Police,2024-08-01,2024-08-14,Emergency cable stay inspection - precautionary closure,TfNSW-EC-2024-007,Transport for NSW,NSW Gazette 2024/88,Reopened after inspection confirmed cable integrity
